{
  "$schema": "https://json-schema.org/draft/2020-12/schema",
  "$id": "status.schema.json",
  "title": "Docent status page data",
  "type": "object",
  "required": ["generatedAt", "openIssueCount", "groups"],
  "properties": {
    "generatedAt": { "type": "string", "format": "date-time" },
    "openIssueCount": { "type": "integer", "minimum": 0 },
    "sourceSnapshot": {
      "type": "object",
      "description": "State snapshot used by `update` mode to detect staleness without diffing summaries. If `newestIssueUpdatedAt` and `openIssueCount` both match the current GitHub state, status is fresh and skipped.",
      "properties": {
        "newestIssueUpdatedAt": { "type": "string", "format": "date-time" },
        "openIssueCount": { "type": "integer", "minimum": 0 },
        "closedIssueCountSince": { "type": "integer", "minimum": 0 }
      }
    },
    "groups": {
      "type": "array",
      "items": {
        "type": "object",
        "required": ["label", "description", "issues"],
        "properties": {
          "label": { "type": "string" },
          "description": { "type": "string" },
          "issues": {
            "type": "array",
            "items": {
              "type": "object",
              "required": ["number", "title", "summary", "url", "updatedAt"],
              "properties": {
                "number": { "type": "integer" },
                "title": { "type": "string" },
                "summary": { "type": "string", "maxLength": 200 },
                "url": { "type": "string", "format": "uri" },
                "updatedAt": { "type": "string", "format": "date-time" },
                "labels": {
                  "type": "array",
                  "items": { "type": "string" }
                }
              }
            }
          }
        }
      }
    }
  }
}
