{
  "generatedAt": "2026-08-29T00:00:00Z",
  "openIssueCount": 1,
  "sourceSnapshot": {
    "issueSetHash": "589aa6c68f95d3b152d7c1ff84f591ad298b976923e2ccf8be9ed0823d0c9ecd",
    "openIssueCount": 1
  },
  "groups": [
    {
      "label": "Feature requests",
      "description": "Proposed additions and integrations currently open for discussion.",
      "issues": [
        {
          "number": 15,
          "title": "Integrate with GSD (Get Shit Done) for spec-driven work surfacing",
          "summary": "Proposal to surface GSD phase artifacts (discuss/plan/execute/verify) on the status and journal pages for repos that use GSD for spec-driven development.",
          "url": "https://github.com/calumjs/docent/issues/15",
          "updatedAt": "2026-04-19T06:50:58Z",
          "labels": []
        }
      ]
    }
  ]
}
